entry_type,competition_ref,finish_rank,author_handle,pass3_source_confidence,c01_te_basic,c02_te_within_fold,c03_te_multi_aggs,c04_te_alt_targets,c05_count_encoding,c06_frequency_encoding,c07_missing_indicator,c08_log_transform,c09_power_polynomial,c10_binning,c11_digit_features,c12_rounding_multi,c13_pairwise_mult,c14_pairwise_add,c15_threshold_flags,c16_brute_force,c17_higher_order_combos,c18_numerics_as_cats,c19_groupby_basic,c20_groupby_count_nunique,c21_groupby_quantiles,c22_groupby_histogram,c23_groupby_zscores,c24_groupby_skew,c25_groupby_division,c26_rowwise_stats,c27_domain_binary_flags,c28_domain_ratios,c29_domain_ordinal,c30_datetime_decomp,c31_cyclical_encoding,c32_orig_target_mean,c33_orig_target_advanced,c34_exact_key_match,c35_approx_neighbor,c36_drift_features,c37_distribution_anomaly,c38_autoencoder_latents,c39_pca_svd,c40_random_projection,c41_genetic_programming,c42_tfidf,c43_char_string_pattern,c44_lasso_generator_recovery,c45_pseudo_labels,c46_residual_features,c47_outlier_aux_classifier,c48_permutation_importance,c49_sfs_backward,c50_correlation_constant,c51_minimal_no_fe,c52_adversarial_validation_fe,c53_forked_base_uncatalogued,n_fe_techniques_used,pass3_notes,pass3_date_coded
control,playground-series-s6e2,15,emreduman05,notebook+writeup,1,1,0,0,0,1,0,0,0,0,0,0,1,0,0,0,0,0,0,0,0,0,0,0,0,0,0,0,0,0,0,0,0,0,0,0,0,0,0,0,0,0,0,0,0,0,0,0,0,0,0,0,4,Emre Duman s6e2 rank 15: XGB+CatBoost blend with nested 15x15 KFold (adopted cdeotte's approach). TE mean per-fold (col 1+2). Frequency encoding via value_counts(normalize=True) on NUMS (col 6). Pairwise multiplicative interactions on top-8 absolute-correlation pairs (col 13). Numeric-as-categorical CAT_ columns are USED FOR TE INPUT not for combinatorial FE so col 18 NOT marked. Original data concat for training (Pass 1). No Group G techniques. No groupby aggregates.,2026-06-01
control,playground-series-s5e10,14,metamodels,writeup-only,1,0,0,0,0,0,0,0,0,0,0,0,0,0,0,0,0,0,0,0,0,0,0,0,0,0,0,0,0,0,0,0,0,0,0,0,0,0,0,0,0,0,0,0,1,0,0,0,0,0,0,0,2,Meta Models s5e10 rank 14: META-ENSEMBLE artifact only - notebook loads pre-saved OOF arrays from external dataset and simple-averages them; no base-model code visible. Writeup describes 100+ base models pooled across XGB / LGBM / CatBoost / TabM / RealMLP / FastAI / PyTorch / RF / ET / YDF variants with HC + Ridge stacking. FE detail in writeup limited to high-level tags: 'with target encoding' (col 1) and 'residual-based' XGB/LGBM variants (col 46). 'with statistical features' too vague to code. 'features-rich' unspecified. Actual base-model FE diversity is high (100+ models) but UNENUMERATED. Source confidence writeup-only because notebook contributes nothing to FE detection.,2026-06-01
control,playground-series-s6e3,16,mhamza0810,notebook+writeup,0,0,0,0,0,1,0,0,0,0,1,0,0,1,1,0,1,0,0,0,0,0,0,0,0,1,0,1,0,0,1,1,0,0,0,0,0,0,0,0,0,0,0,0,0,0,0,0,0,0,0,0,9,mhamza0810 s6e3 rank 16: 34-model stacked ensemble with Ridge meta-learner augmented with polynomial interaction features. Rich FE module per writeup. TRUE: c06 frequency encoding of numerics; c11 digit features (first/last digit/mod10/mod12 of tenure/MonthlyCharges/TotalCharges); c14 'charges deviation' = additive feature; c15 round-number-flags (threshold binary flags); c17 categorical combos (n-gram bigrams+trigrams); c26 rowwise stats (service count features); c28 domain ratios (monthly-to-total ratio + avg monthly charges); c31 sin/cos cyclical embeddings at multiple frequencies; c32 ORIG_proba mappings from original Telco dataset = original target mean as feature. NOT marked: c21 quantile distance features (not clearly groupby) c23 class-conditional percentile (not clean groupby) c38 DVAE features WERE available from mhamza0810 upstream FE but EXPLICITLY DROPPED in cell 5. Polynomial meta-learner is ensemble method (Pass 1) not Pass 3.,2026-06-01
control,playground-series-s5e8,15,tilii7,notebook+writeup,1,0,0,0,1,0,0,0,0,0,0,0,0,0,0,0,0,0,0,0,0,0,0,0,0,0,0,0,0,0,0,0,0,0,0,0,0,0,0,0,1,0,0,0,0,0,0,0,0,0,0,0,3,Tilii s5e8 rank 15 (SAME AUTHOR AS S5E10 R1 WINNER!): 'Many models many ensembles' approach. Best 5 individual models: CatBoost Optuna xLearn FFM XGBoost Optuna Keras FM LAMA DenseLight. Writeup focuses on 13 GP features as the distinctive contribution. TRUE: c01 TE basic ('counting and target encoding' mentioned for other features); c05 count encoding ('counting' in same sentence); c41 genetic programming features (13 GP_NN features via cavalab/ellyn package). Notebook ONLY shows GP feature generation; base-model training not in notebook. METHODOLOGICAL NOTE: Tilii used GP in his winning s5e10 entry too -- it's his author signature not a winner-distinguishing technique. At s5e8 the winner (mahog ensemble-standard) has 0 Group G techniques; control Tilii has 1. So Group G usage at s5e8 is REVERSED from heavyweight pattern. Confirms 'heavyweight Learned% finding' is competition-conditional not universal.,2026-06-01
control,playground-series-s6e4,19,elenkapetrova,notebook+writeup,1,1,0,0,0,1,0,0,0,1,1,0,0,0,0,0,1,0,0,0,0,0,0,0,0,0,0,0,0,0,0,1,0,0,0,0,0,0,0,0,0,0,0,0,0,0,0,0,0,0,0,1,7,Elena Petrova s6e4 rank 19: 29-model ensemble with Ridge meta-learner (Optuna-tuned). Writeup enumerates feature sets per base-model variant. TRUE: c01 nested target encoding; c02 within-fold (nested TE) explicit; c06 frequency encoding; c10 binning numerical features (multiple bin variants); c11 digit features; c17 categorical combos (combinations of categorical features + OHE); c32 target encoding using original dataset; c53 forked uncatalogued FE (2 models from public notebooks arshikhan810 + rawashishsin). NOT marked conservatively: 'Chris formula' and 'magical feature' too vague to code without seeing actual formulas; 'stat_median' features could be groupby or imputation - no clear groupby setup described. Notebook is meta-only (loads OOFs from external dataset); writeup carries the FE detail.,2026-06-01
control,playground-series-s5e5,8,pinoystat,notebook+writeup,0,0,0,0,0,0,0,0,0,0,0,0,0,0,0,0,0,0,0,0,0,0,0,0,0,0,0,0,0,0,0,0,0,0,0,0,0,0,0,0,0,0,0,0,0,0,0,0,0,1,0,1,0,Pinoystat s5e5 rank 8 (private LB ~0.05846 vs cdeotte 0.05841, gap 0.00005 PHOTO-FINISH): 5-model HC ensemble (3 TensorFlow custom NN architectures + 2 forked public notebooks from jiaoyouzhang XGB + chrisk321 CatBoost). Author explicit minimal-FE approach 'I did not bother optimizing or doing some unique stuff on the public notebooks' (c51). Notebook cell 9 shows: pairwise multiplicative interactions (F_DxB Duration*Body_Temp F_HxB Heart_Rate*Body_Temp) COMMENTED OUT as 'not ok'; integer-casting features (not real binning); original dataset concat as ROWS (Pass 1 not Pass 3 derived feature); Box-Cox target transform (modeling). 4-way data split for two-stage stacking. Forked 2 public notebooks (c53 uncatalogued FE). n_fe_tech=0 meta=2 (c51+c53).,2026-06-01
control,playground-series-s5e6,21,oscarm524,notebook+writeup,0,0,0,0,0,0,0,0,0,1,0,0,0,0,0,0,0,0,0,0,0,0,0,0,0,0,0,0,0,0,0,0,0,0,0,0,0,0,0,0,0,0,0,0,0,0,0,0,0,1,0,0,1,Oscar Aguilar (oscarm524) s5e6 rank 21 (SECOND AUTHOR OVERLAP with winners corpus - he is rank 2 at s3e23). 100+ base models (CatBoost 20+ LGBM 50+ XGBoost 50+ Logistic + Multinomial NB + GradientBoostedTrees) with 50+ LinearDiscriminantAnalysis stackers + HC ensemble of top 4. Notebook cell 23 confirms: 'Soil Type' and 'Crop Type' cast as category. 'What worked': (1) treating all features as categorical (paddykb pattern coded as c10 - same as omid s4e10 in winners corpus) (2) multiple copies of original dataset (Pass 1 augmentation). 'What didn't work': Feature engineering (explicit c51). 10-fold StratifiedKFold. No groupby no TE no digits no Group G techniques. n_fe_tech=1 meta=1.,2026-06-01
control,playground-series-s5e4,6,masaishi,notebook+writeup,1,0,0,0,0,0,0,0,1,0,0,1,0,0,0,1,1,1,1,0,0,0,0,0,0,1,1,1,0,0,1,1,0,0,0,0,0,0,0,0,0,0,0,0,0,0,0,0,0,0,0,0,13,masaishi s5e4 rank 6 (FULL GITHUB REPO with README + notebooks + src code; rank 6 closer to top than ideal but s5e4 lacked lower-rank writeups). FE breadth comparable to heavyweight winners. TRUE: c01 TE basic (group mean target encoding via systematic combinatorial selection); c09 polynomial (Episode_Length squared + cubed); c12 multi-precision rounding (floor() integer-part + decimal-component); c16 brute-force combinatorial with selection (1-4-way combinations evaluated by RMSE keep best); c17 categorical combos (1-4 feature combinations); c18 numerics-as-cats-then-combos (numerics rounded to int and concatenated as string for combo group); c19 groupby basic stats (count/std/mean in group_by aggregations); c26 rowwise stats (Diff_Squared = sum of squared deviations from medians); c27 domain binary flag (Is_Positive_Sentiment); c28 domain ratios (Length_per_Ads, Length_per_Host, Length_per_Guest = podcast-domain ratios); c31 cyclical encoding (sin/cos of Day/Time at multiple frequencies + Long_Term_Cycle for Episode_Num); c32 original target mean (group means computed including original data merged). NOT marked: c02 within-fold (uses 80/20 holdout not nested CV); c13 generic pairwise mult (overlaps with c28 domain ratios). Data leak postprocessing (decimal-digit overwrite + Number_of_Ads correction + group-mean override) is prediction-level not Pass 3 features. CRITICAL: this control has MORE techniques than winner greysky (13 vs 6). REVERSE pattern from heavyweight comparisons - confirms technique-count gap is paradigm-specific.,2026-06-01
